{
  "$schema": "https://json-schema.org/draft/2020-12/schema",
  "schemaVersion": 1,
  "name": "llm-iq-data-index",
  "description": "鹈鹕基准与前沿大模型可视化评测全量运行索引",
  "repository": "https://github.com/xumetide-dev/llm-iq-data",
  "updatedAt": "2026-09-27T02:17:45.000Z",
  "totalRuns": 1,
  "days": [
    {
      "date": "2026-09-27",
      "runs": 1,
      "path": "runs/2026/09/27"
    }
  ]
}
