{
  "schemaVersion": 1,
  "name": "llm-iq-data-index",
  "description": "鹈鹕基准与前沿大模型可视化评测全量运行索引",
  "repository": "https://github.com/meomeo-dev/llm-iq-data",
  "updatedAt": "2026-09-27T16:21:41.365Z",
  "totalRuns": 69,
  "days": [
    {
      "date": "2026-09-27",
      "runs": 14,
      "path": "runs/2026/09/27"
    },
    {
      "date": "2026-09-26",
      "runs": 19,
      "path": "runs/2026/09/26"
    },
    {
      "date": "2026-09-25",
      "runs": 8,
      "path": "runs/2026/09/25"
    },
    {
      "date": "2026-09-24",
      "runs": 19,
      "path": "runs/2026/09/24"
    },
    {
      "date": "2026-09-23",
      "runs": 7,
      "path": "runs/2026/09/23"
    },
    {
      "date": "2026-09-22",
      "runs": 2,
      "path": "runs/2026/09/22"
    }
  ]
}
